{"schemaVersion":"collector-runtime-artifact.v1","artifactId":"collector-artifact-line1","artifactRevision":12,"projectId":"11111111-1111-4111-8111-111111111111","collectorVersion":"1.0.0","connections":[{"connectionId":"aaaaaaaa-1111-4111-8111-111111111111","protocolFamily":"modbus","driverId":"modbus.tcp","driverVersion":"1.0.0","schemaVersion":1,"enabled":true,"requiredOperations":["point.read"],"defaultAcquisition":{"intervalMs":1000,"deadband":0,"changeOnly":false}}],"pointMappings":[{"datapointId":"22222222-2222-4222-8222-222222222222","connectionId":"aaaaaaaa-1111-4111-8111-111111111111","variableId":"bbbbbbbb-1111-4111-8111-111111111111","dataType":"float64","elementCount":1,"addressSchemaVersion":1,"address":{"station":1,"area":"holdingRegister","address":0},"readOptions":{"dataFormat":"CDAB"},"acquisitionMode":"inherit","effectiveAcquisition":{"intervalMs":1000,"deadband":0,"changeOnly":false},"enabled":true}],"wal":{"fsync":"before-publish","checksum":"crc32c","commitMarker":"after-jetstream-puback"}}
